{"preview":false,"lastrow":true,"result":{"Account_Domain":"ACCOUNTING1","Account_Name":["Administrator","-"],"ComputerName":"accounting1","EventCode":"4732","EventType":"0","Group_Domain":"Builtin","Group_Name":"Users","Keywords":"Audit Success","LogName":"Security","Logon_ID":"0x19D50EC","Message":"A member was added to a security-enabled local group.\r\n\r\nSubject:\r\n\tSecurity ID:\t\tS-1-5-21-2020954294-3820947412-549806118-500\r\n\tAccount Name:\t\tAdministrator\r\n\tAccount Domain:\t\tACCOUNTING1\r\n\tLogon ID:\t\t0x19D50EC\r\n\r\nMember:\r\n\tSecurity ID:\t\tS-1-5-21-2020954294-3820947412-549806118-1005\r\n\tAccount Name:\t\t-\r\n\r\nGroup:\r\n\tSecurity ID:\t\tS-1-5-32-545\r\n\tGroup Name:\t\tUsers\r\n\tGroup Domain:\t\tBuiltin\r\n\r\nAdditional Information:\r\n\tPrivileges:\t\t-","OpCode":"Info","Privileges":"-","RecordNumber":"434408","Security_ID":["S-1-5-21-2020954294-3820947412-549806118-500","S-1-5-21-2020954294-3820947412-549806118-1005","S-1-5-32-545"],"SourceName":"Microsoft Windows security auditing.","TaskCategory":"Security Group Management","Type":"Information","_raw":"09/13/2023 04:33:18 PM\nLogName=Security\nEventCode=4732\nEventType=0\nComputerName=accounting1\nSourceName=Microsoft Windows security auditing.\nType=Information\nRecordNumber=434408\nKeywords=Audit Success\nTaskCategory=Security Group Management\nOpCode=Info\nMessage=A member was added to a security-enabled local group.\r\n\r\nSubject:\r\n\tSecurity ID:\t\tS-1-5-21-2020954294-3820947412-549806118-500\r\n\tAccount Name:\t\tAdministrator\r\n\tAccount Domain:\t\tACCOUNTING1\r\n\tLogon ID:\t\t0x19D50EC\r\n\r\nMember:\r\n\tSecurity ID:\t\tS-1-5-21-2020954294-3820947412-549806118-1005\r\n\tAccount Name:\t\t-\r\n\r\nGroup:\r\n\tSecurity ID:\t\tS-1-5-32-545\r\n\tGroup Name:\t\tUsers\r\n\tGroup Domain:\t\tBuiltin\r\n\r\nAdditional Information:\r\n\tPrivileges:\t\t-","_time":"2023-09-13T23:33:18.000+0000","host":"ACCOUNTING1","index":"main","linecount":"30","punct":"//_::_=====___.===_=__==______-__.\\r\\r:\\rt_:tt-------","source":"WinEventLog:Security","sourcetype":"WinEventLog:Security","splunk_server":"ip-10-0-0-6.us-west-2.compute.internal"}}
